{
  "answer_events_ref": "study/history/2026/06/2026-06-29.apc.jsonl",
  "app_version": "stage-17k-z-r4",
  "cards_answered": 1,
  "cards_correct": 1,
  "cards_seen": 1,
  "cards_skipped": 0,
  "cards_wrong": 0,
  "companion_enabled": true,
  "content_hash": "hash_example",
  "created_at": "2026-06-29T00:00:00Z",
  "deck_id": "deck_example",
  "deleted_at": null,
  "device_id": "device_example",
  "duration_ms": 600000,
  "ended_at": "2026-06-29T00:10:00Z",
  "local_only_source_refs": [],
  "owner_subject_hash": "subject_hash_example",
  "previous_hash": null,
  "record_id": "session_example",
  "record_type": "study_session",
  "revision": 1,
  "schema_version": "17k-z-r4",
  "session_id": "session_example",
  "source": "apc_native",
  "started_at": "2026-06-29T00:00:00Z",
  "stats_delta_hash": "stats_delta_hash_example",
  "study_source_type": "apc_native",
  "updated_at": "2026-06-29T00:00:00Z",
  "user_id_hash": "subject_hash_example"
}
